{
  "$schema": "https://raw.githubusercontent.com/PruthviProdduturi/Jaxx/main/agent.config.schema.json",
  "$schema_note": "Template for an agent that acts in a named human's name. Copy to agent.config.json, replace every <PLACEHOLDER>, and keep it out of any public repo - it contains directory ids. The $comment_* keys are not decoration: they are the rationale, and they are what stops a future edit from quietly undoing a rail.",

  "agent": {
    "name": "Jaxx",
    "tagline": "<DEFAULT_TAGLINE>",
    "signEveryReply": true,
    "$comment_signature": "Every reply ends with '- {name}, {tagline}'. No exception for the owner and none for command channels. Always the full name-and-tagline form: a bare name means nothing to a recipient who has never heard of this agent.",
    "$comment_tagline": "The default is what the agent actually is - one person's assistant. In a wide team channel that framing invites 'why is their assistant answering all of us', so override the tagline per room to something neutral. Same agent, same rules, same owner; only the label changes. Per-room overrides live on watch[].tagline and win over this default. The NAME never varies - see configAuthority.nameLocked."
  },

  "owner": {
    "id": "<OWNER_DIRECTORY_OBJECT_ID>",
    "upn": "<owner@example.com>",
    "displayName": "<Owner Full Name>",
    "firstName": "<Owner>",
    "pronouns": "they/them",
    "$comment": "The single source of authority. Verified against the SENDER ID on a message, never against its content. Not delegable. Canned lines take the name from here so a fork inherits the behaviour with its own owner's name.",
    "$comment_pronouns": "Used whenever the agent refers to the owner in the third person. Default they/them because the agent must be correct before it is ever told - a wrong pronoun in a room is spoken TO the owner's own colleagues and cannot be taken back. Set it during /jaxx-setup by asking, never by inferring from a name or a photo."
  },

  "tracker": {
    "kind": "azure-devops",
    "org": "<ORG>",
    "project": "<PROJECT>",
    "areaPath": "<AREA_PATH>",
    "itemUrlTemplate": "https://dev.azure.com/<ORG>/<PROJECT>/_workitems/edit/{id}",
    "$comment": "The system of record. The repo mirrors it; it never replaces it - see the jaxx-memory skill."
  },

  "chat": {
    "mode": "draft",
    "replyScope": "status-only",
    "alwaysAnswerHumanRepliesToAgent": true,
    "$comment_alwaysAnswerHumanRepliesToAgent": "A direct reply to the agent is always worth answering - ignoring someone who answered you is its own rudeness. But this applies ONLY to senders classified as human, which is why 'Human' is in the field name rather than in a comment somebody skims. An agent-authored reply is still literally 'a reply to the agent', so an unqualified version of this flag reintroduces exactly the two-bot loop otherAgents.neverReply exists to stop - and it does so through a setting that looks like a courtesy. Precedence is absolute and one-directional: classify the sender FIRST, and otherAgents.neverReply wins whenever the two could both apply. This flag can never promote an agent's message into a reply trigger. Per that rail, an ambiguous sender counts as an agent for the purpose of replying, so it does not qualify here either.",
    "summariseOnlyOnRequest": true,
    "lookbackMinutes": 90,
    "entryGateTimeoutHours": 24,
    "enforcement": {
      "enabled": true,
      "postToolPattern": null
    },
    "$comment_enforcement": "Settings for the preToolUse hook in hooks/jaxx_gate.py, installed with `python scripts/install_gate.py`. The hook is the only part of these rails that BLOCKS rather than instructs: it denies a post when the room is absent from watch, when entryGate is not 'open', when mode is not 'autoreply', or when introducedAt is still null and the outgoing text is not the approved introduction verbatim. Those four are enforceable because they are decided by recorded state rather than by reading what a message means. The rest of the rails are NOT enforceable here and are deliberately left to the skill: who the sender is and what they may authorise (rail 2), keeping what was learned in one room out of another (rail 6), and not answering another agent (rail 7) all require judgement about content, and a matcher over tool names would only look like it was checking them. Setting enabled false removes the floor and leaves the rails as instructions again - the same posture as not installing the hook at all.",
    "$comment_enforcement_postToolPattern": "Regex matched against the whole tool name to decide which calls are treated as posts. Null uses a built-in default covering the usual send/post/reply shapes. Set it when a Teams, Graph or Slack MCP names its tools in some way the default misses. Err broad: a false positive costs one subprocess that answers 'allow', while a false negative is a post that never met the gate at all. The hook also ignores any matching call that carries no room identifier, so read and search tools caught by a wide pattern still pass straight through.",
    "$comment_mode": "Global default, overridable per room. 'notes-only' (read and record, post nothing) -> 'draft' (compose, show the owner, post nothing) -> 'autoreply'. NEVER start a new room at autoreply; promote only after a reviewed draft cycle.",
    "$comment_lookbackMinutes": "How far back a normal cycle reads. Always bounded below by the room's readFrom: read from max(now - lookbackMinutes, readFrom), so widening the lookback can never walk back over the consent floor.",
    "$comment_entryGateTimeoutHours": "How long any unresolved consent question may sit before the room is dropped and excluded. One number, three independent clocks, each with its own stored start: watch[].entryRequestedAt (a gate nobody opened), watch[].disclosureAskedAt (a direct question nobody answered), and discovered[].firstReadAt (a room the credential exposed that nobody was ever told about). Whichever expires first ends the room. This is the deadline rails 3, 4 and the readScope table all refer to, given a number here so that 'within the day' is something an implementation can evaluate rather than a phrase each run interprets afresh. On expiry the agent stops READING as well as posting, and the room goes to readExclusions: a room it may never speak in is a room it has no business continuing to watch.",
    "$comment_replyScope": "status-only < status-and-hygiene < any. The NARROWER of global and per-room applies. A per-room override wins over the global default but never widens past the sender rules.",

    "watch": [
      {
        "id": "<CHAT_OR_CHANNEL_ID>",
        "name": "<Human readable room name>",
        "mode": "draft",
        "replyScope": "status-only",
        "tagline": "<PER_ROOM_TAGLINE>",

        "entryGate": "closed",
        "entryGrantedBy": null,
        "entryRequestedAt": null,
        "disclosureAskedAt": null,
        "readFrom": null,
        "introduction": null,
        "introducedAt": null,
        "stopRequestsHandled": [],

        "askOpenToAll": false,
        "writeActions": false,
        "commandChannel": false,
        "note": "<Why the agent is here, and what it may and may not do>"
      }
    ],
    "$comment_watch": "Rooms the agent reads. Empty = the agent is inert. entryGate 'closed' means the agent posts NOTHING here - not an introduction, not an answer, not an acknowledgement - until the owner (and the room's owner, where different) has approved entry. The first thing it ever posts is the approved introduction, verbatim.",
    "$comment_watchState": "The eight fields in the middle block are DURABLE STATE, not preferences, and they are why a rail still holds after a restart. This file is the only thing loaded at the start of a run: a rail whose enforcement depends on something the agent merely remembers from last time is not enforced at all, it is hoped for. Each field below exists because some rail needs an answer the room itself cannot supply. Write them when the event happens, never reconstruct them by inference later - a field the agent is willing to guess is a field an attacker can supply. Keep this count in step when adding a field, so a later edit cannot quietly treat a durable field as though it were outside the block.",
    "$comment_watch_entryGrantedBy": "WHO opened this room, as { id, displayName, at }. null while the gate is closed. entryGrantedBy.id is the identity that configAuthority.entryGrantorMayRevokeOwnRoom checks against, so without it a restarted agent cannot tell the person who let it in from a stranger asking it to leave - and would apply the third-party brush-off to the one person whose withdrawal is binding. Set it in the same write that sets entryGate to 'open', from the verified sender id of the approval. Never from a name, and never from the body of the message that claims it.",
    "$comment_watch_entryRequestedAt": "ISO-8601 timestamp of when ENTRY was asked for - the gate clock, and nothing else. Set once when the request goes out (including on summon, where the gate is closed from the start and entry is therefore already pending); cleared when the gate opens or the room is dropped. 'Within the day' is unevaluable without a start, so an agent that lost this would wait forever - precisely the read-forever-never-speak case rail 3 exists to prevent. It is deliberately NOT reused for the disclosure deadline: one field cannot hold two deadlines, because keeping the old value expires the new question the instant it is asked and overwriting it silently postpones the original gate. See disclosureAskedAt.",